{
  "$schema": "../schemas/validation.schema.json",
  "schemaVersion": 2,
  "definitionVersion": "2.0.0-draft.5",
  "id": "ifosoft.journal-dennik1.validation",
  "kind": "validation",
  "status": "reviewDraft",
  "productionApproved": false,
  "requiresCapabilities": [
    "positioned.v2"
  ],
  "sourceRefs": [],
  "reviewNotes": [
    "Blank monetary values remain blank; no implicit effective zero.",
    "CSV expected fiscal year is comparison-only and never supplies parsing or detection context.",
    "Printed aggregate controls remain disabled pending fixture reconciliation."
  ],
  "layoutRef": {
    "id": "ifosoft.journal-dennik1",
    "version": "2.0.0-draft.5"
  },
  "printedControls": [
    {
      "id": "original.foot1.field-85",
      "variantRef": "original",
      "blockRef": "foot1",
      "fieldRef": "field-85",
      "scope": {
        "kind": "document",
        "groupRef": null
      }
    },
    {
      "id": "original.foot1.field-86",
      "variantRef": "original",
      "blockRef": "foot1",
      "fieldRef": "field-86",
      "scope": {
        "kind": "document",
        "groupRef": null
      }
    },
    {
      "id": "alternate-header.foot1.field-82",
      "variantRef": "alternate-header",
      "blockRef": "foot1",
      "fieldRef": "field-82",
      "scope": {
        "kind": "document",
        "groupRef": null
      }
    },
    {
      "id": "alternate-header.foot1.field-83",
      "variantRef": "alternate-header",
      "blockRef": "foot1",
      "fieldRef": "field-83",
      "scope": {
        "kind": "document",
        "groupRef": null
      }
    }
  ],
  "calculations": [
    {
      "id": "calc.original.foot1.field-85",
      "op": "sum",
      "enabled": false,
      "evidenceStatus": "unverified",
      "sourceRefs": [],
      "reviewNotes": [],
      "scope": {
        "kind": "document",
        "groupRef": null
      },
      "memberSelector": {
        "semanticClasses": [],
        "aggregationMemberships": [
          "exportedDetails"
        ],
        "level": "any",
        "occurrences": "records"
      },
      "inputRefs": [
        {
          "kind": "field",
          "semanticName": "debitControl"
        }
      ],
      "prerequisites": [
        "resolvedClassification",
        "resolvedGroupMembership",
        "unambiguousOperands",
        "completeScope"
      ],
      "onMissingInput": "inconclusive"
    },
    {
      "id": "calc.original.foot1.field-86",
      "op": "sum",
      "enabled": false,
      "evidenceStatus": "unverified",
      "sourceRefs": [],
      "reviewNotes": [],
      "scope": {
        "kind": "document",
        "groupRef": null
      },
      "memberSelector": {
        "semanticClasses": [],
        "aggregationMemberships": [
          "exportedDetails"
        ],
        "level": "any",
        "occurrences": "records"
      },
      "inputRefs": [
        {
          "kind": "field",
          "semanticName": "creditControl"
        }
      ],
      "prerequisites": [
        "resolvedClassification",
        "resolvedGroupMembership",
        "unambiguousOperands",
        "completeScope"
      ],
      "onMissingInput": "inconclusive"
    },
    {
      "id": "calc.alternate-header.foot1.field-82",
      "op": "sum",
      "enabled": false,
      "evidenceStatus": "unverified",
      "sourceRefs": [],
      "reviewNotes": [],
      "scope": {
        "kind": "document",
        "groupRef": null
      },
      "memberSelector": {
        "semanticClasses": [],
        "aggregationMemberships": [
          "exportedDetails"
        ],
        "level": "any",
        "occurrences": "records"
      },
      "inputRefs": [
        {
          "kind": "field",
          "semanticName": "debitControl"
        }
      ],
      "prerequisites": [
        "resolvedClassification",
        "resolvedGroupMembership",
        "unambiguousOperands",
        "completeScope"
      ],
      "onMissingInput": "inconclusive"
    },
    {
      "id": "calc.alternate-header.foot1.field-83",
      "op": "sum",
      "enabled": false,
      "evidenceStatus": "unverified",
      "sourceRefs": [],
      "reviewNotes": [],
      "scope": {
        "kind": "document",
        "groupRef": null
      },
      "memberSelector": {
        "semanticClasses": [],
        "aggregationMemberships": [
          "exportedDetails"
        ],
        "level": "any",
        "occurrences": "records"
      },
      "inputRefs": [
        {
          "kind": "field",
          "semanticName": "creditControl"
        }
      ],
      "prerequisites": [
        "resolvedClassification",
        "resolvedGroupMembership",
        "unambiguousOperands",
        "completeScope"
      ],
      "onMissingInput": "inconclusive"
    }
  ],
  "rules": [
    {
      "id": "compare.original.foot1.field-85",
      "op": "compare",
      "enabled": false,
      "evidenceStatus": "unverified",
      "sourceRefs": [],
      "reviewNotes": [
        "Disabled pending fixture reconciliation of membership, scope and printed control semantics."
      ],
      "scope": {
        "kind": "document",
        "groupRef": null
      },
      "calculatedRef": "calc.original.foot1.field-85",
      "printedControlRef": "original.foot1.field-85",
      "absoluteTolerance": "0.01",
      "coverageRequirement": "completeScope",
      "onMissingInput": "inconclusive",
      "onPartialCoverage": "notEvaluated"
    },
    {
      "id": "compare.original.foot1.field-86",
      "op": "compare",
      "enabled": false,
      "evidenceStatus": "unverified",
      "sourceRefs": [],
      "reviewNotes": [
        "Disabled pending fixture reconciliation of membership, scope and printed control semantics."
      ],
      "scope": {
        "kind": "document",
        "groupRef": null
      },
      "calculatedRef": "calc.original.foot1.field-86",
      "printedControlRef": "original.foot1.field-86",
      "absoluteTolerance": "0.01",
      "coverageRequirement": "completeScope",
      "onMissingInput": "inconclusive",
      "onPartialCoverage": "notEvaluated"
    },
    {
      "id": "compare.alternate-header.foot1.field-82",
      "op": "compare",
      "enabled": false,
      "evidenceStatus": "unverified",
      "sourceRefs": [],
      "reviewNotes": [
        "Disabled pending fixture reconciliation of membership, scope and printed control semantics."
      ],
      "scope": {
        "kind": "document",
        "groupRef": null
      },
      "calculatedRef": "calc.alternate-header.foot1.field-82",
      "printedControlRef": "alternate-header.foot1.field-82",
      "absoluteTolerance": "0.01",
      "coverageRequirement": "completeScope",
      "onMissingInput": "inconclusive",
      "onPartialCoverage": "notEvaluated"
    },
    {
      "id": "compare.alternate-header.foot1.field-83",
      "op": "compare",
      "enabled": false,
      "evidenceStatus": "unverified",
      "sourceRefs": [],
      "reviewNotes": [
        "Disabled pending fixture reconciliation of membership, scope and printed control semantics."
      ],
      "scope": {
        "kind": "document",
        "groupRef": null
      },
      "calculatedRef": "calc.alternate-header.foot1.field-83",
      "printedControlRef": "alternate-header.foot1.field-83",
      "absoluteTolerance": "0.01",
      "coverageRequirement": "completeScope",
      "onMissingInput": "inconclusive",
      "onPartialCoverage": "notEvaluated"
    }
  ]
}
