{
  "$schema": "../schemas/validation.schema.json",
  "schemaVersion": 2,
  "definitionVersion": "2.0.0-draft.5",
  "id": "ifosoft.account-plan-uctrozvrh.validation",
  "kind": "validation",
  "status": "reviewDraft",
  "productionApproved": false,
  "requiresCapabilities": [
    "positioned.v2"
  ],
  "sourceRefs": [],
  "reviewNotes": [
    "Blank monetary values remain blank; no implicit effective zero.",
    "CSV expected fiscal year is comparison-only and never supplies parsing or detection context.",
    "Printed aggregate controls remain disabled pending fixture reconciliation."
  ],
  "layoutRef": {
    "id": "ifosoft.account-plan-uctrozvrh",
    "version": "2.0.0-draft.5"
  },
  "printedControls": [
    {
      "id": "urozvrh.foot2.field-45",
      "variantRef": "urozvrh",
      "blockRef": "foot2",
      "fieldRef": "field-45",
      "scope": {
        "kind": "group",
        "groupRef": "accountClass"
      }
    },
    {
      "id": "urozvrh.foot3.field-51",
      "variantRef": "urozvrh",
      "blockRef": "foot3",
      "fieldRef": "field-51",
      "scope": {
        "kind": "group",
        "groupRef": "accountGroup"
      }
    },
    {
      "id": "urozvrh-v2-unverified.foot1.field-18",
      "variantRef": "urozvrh-v2-unverified",
      "blockRef": "foot1",
      "fieldRef": "field-18",
      "scope": {
        "kind": "document",
        "groupRef": null
      }
    },
    {
      "id": "urozvrh-v2-unverified.foot2.field-21",
      "variantRef": "urozvrh-v2-unverified",
      "blockRef": "foot2",
      "fieldRef": "field-21",
      "scope": {
        "kind": "group",
        "groupRef": "accountClass"
      }
    },
    {
      "id": "urozvrh-v2-unverified.foot3.field-49",
      "variantRef": "urozvrh-v2-unverified",
      "blockRef": "foot3",
      "fieldRef": "field-49",
      "scope": {
        "kind": "group",
        "groupRef": "accountGroup"
      }
    }
  ],
  "calculations": [
    {
      "id": "calc.urozvrh.foot2.field-45",
      "op": "count",
      "enabled": false,
      "evidenceStatus": "unverified",
      "sourceRefs": [],
      "reviewNotes": [],
      "scope": {
        "kind": "group",
        "groupRef": "accountClass"
      },
      "memberSelector": {
        "semanticClasses": [],
        "aggregationMemberships": [
          "numberedRows"
        ],
        "level": "any",
        "occurrences": "records"
      },
      "inputRefs": [],
      "prerequisites": [
        "resolvedClassification",
        "resolvedGroupMembership",
        "unambiguousOperands",
        "completeScope"
      ],
      "onMissingInput": "inconclusive",
      "mode": "occurrences",
      "distinctKey": []
    },
    {
      "id": "calc.urozvrh.foot3.field-51",
      "op": "count",
      "enabled": false,
      "evidenceStatus": "unverified",
      "sourceRefs": [],
      "reviewNotes": [],
      "scope": {
        "kind": "group",
        "groupRef": "accountGroup"
      },
      "memberSelector": {
        "semanticClasses": [],
        "aggregationMemberships": [
          "numberedRows"
        ],
        "level": "any",
        "occurrences": "records"
      },
      "inputRefs": [],
      "prerequisites": [
        "resolvedClassification",
        "resolvedGroupMembership",
        "unambiguousOperands",
        "completeScope"
      ],
      "onMissingInput": "inconclusive",
      "mode": "occurrences",
      "distinctKey": []
    },
    {
      "id": "calc.urozvrh-v2-unverified.foot1.field-18",
      "op": "count",
      "enabled": false,
      "evidenceStatus": "unverified",
      "sourceRefs": [],
      "reviewNotes": [],
      "scope": {
        "kind": "document",
        "groupRef": null
      },
      "memberSelector": {
        "semanticClasses": [],
        "aggregationMemberships": [
          "numberedRows"
        ],
        "level": "any",
        "occurrences": "records"
      },
      "inputRefs": [],
      "prerequisites": [
        "resolvedClassification",
        "resolvedGroupMembership",
        "unambiguousOperands",
        "completeScope"
      ],
      "onMissingInput": "inconclusive",
      "mode": "occurrences",
      "distinctKey": []
    },
    {
      "id": "calc.urozvrh-v2-unverified.foot2.field-21",
      "op": "count",
      "enabled": false,
      "evidenceStatus": "unverified",
      "sourceRefs": [],
      "reviewNotes": [],
      "scope": {
        "kind": "group",
        "groupRef": "accountClass"
      },
      "memberSelector": {
        "semanticClasses": [],
        "aggregationMemberships": [
          "numberedRows"
        ],
        "level": "any",
        "occurrences": "records"
      },
      "inputRefs": [],
      "prerequisites": [
        "resolvedClassification",
        "resolvedGroupMembership",
        "unambiguousOperands",
        "completeScope"
      ],
      "onMissingInput": "inconclusive",
      "mode": "occurrences",
      "distinctKey": []
    },
    {
      "id": "calc.urozvrh-v2-unverified.foot3.field-49",
      "op": "count",
      "enabled": false,
      "evidenceStatus": "unverified",
      "sourceRefs": [],
      "reviewNotes": [],
      "scope": {
        "kind": "group",
        "groupRef": "accountGroup"
      },
      "memberSelector": {
        "semanticClasses": [],
        "aggregationMemberships": [
          "numberedRows"
        ],
        "level": "any",
        "occurrences": "records"
      },
      "inputRefs": [],
      "prerequisites": [
        "resolvedClassification",
        "resolvedGroupMembership",
        "unambiguousOperands",
        "completeScope"
      ],
      "onMissingInput": "inconclusive",
      "mode": "occurrences",
      "distinctKey": []
    }
  ],
  "rules": [
    {
      "id": "compare.urozvrh.foot2.field-45",
      "op": "compare",
      "enabled": false,
      "evidenceStatus": "unverified",
      "sourceRefs": [],
      "reviewNotes": [
        "Disabled pending fixture reconciliation of membership, scope and printed control semantics."
      ],
      "scope": {
        "kind": "group",
        "groupRef": "accountClass"
      },
      "calculatedRef": "calc.urozvrh.foot2.field-45",
      "printedControlRef": "urozvrh.foot2.field-45",
      "absoluteTolerance": "0",
      "coverageRequirement": "completeScope",
      "onMissingInput": "inconclusive",
      "onPartialCoverage": "notEvaluated"
    },
    {
      "id": "compare.urozvrh.foot3.field-51",
      "op": "compare",
      "enabled": false,
      "evidenceStatus": "unverified",
      "sourceRefs": [],
      "reviewNotes": [
        "Disabled pending fixture reconciliation of membership, scope and printed control semantics."
      ],
      "scope": {
        "kind": "group",
        "groupRef": "accountGroup"
      },
      "calculatedRef": "calc.urozvrh.foot3.field-51",
      "printedControlRef": "urozvrh.foot3.field-51",
      "absoluteTolerance": "0",
      "coverageRequirement": "completeScope",
      "onMissingInput": "inconclusive",
      "onPartialCoverage": "notEvaluated"
    },
    {
      "id": "compare.urozvrh-v2-unverified.foot1.field-18",
      "op": "compare",
      "enabled": false,
      "evidenceStatus": "unverified",
      "sourceRefs": [],
      "reviewNotes": [
        "Disabled pending fixture reconciliation of membership, scope and printed control semantics."
      ],
      "scope": {
        "kind": "document",
        "groupRef": null
      },
      "calculatedRef": "calc.urozvrh-v2-unverified.foot1.field-18",
      "printedControlRef": "urozvrh-v2-unverified.foot1.field-18",
      "absoluteTolerance": "0",
      "coverageRequirement": "completeScope",
      "onMissingInput": "inconclusive",
      "onPartialCoverage": "notEvaluated"
    },
    {
      "id": "compare.urozvrh-v2-unverified.foot2.field-21",
      "op": "compare",
      "enabled": false,
      "evidenceStatus": "unverified",
      "sourceRefs": [],
      "reviewNotes": [
        "Disabled pending fixture reconciliation of membership, scope and printed control semantics."
      ],
      "scope": {
        "kind": "group",
        "groupRef": "accountClass"
      },
      "calculatedRef": "calc.urozvrh-v2-unverified.foot2.field-21",
      "printedControlRef": "urozvrh-v2-unverified.foot2.field-21",
      "absoluteTolerance": "0",
      "coverageRequirement": "completeScope",
      "onMissingInput": "inconclusive",
      "onPartialCoverage": "notEvaluated"
    },
    {
      "id": "compare.urozvrh-v2-unverified.foot3.field-49",
      "op": "compare",
      "enabled": false,
      "evidenceStatus": "unverified",
      "sourceRefs": [],
      "reviewNotes": [
        "Disabled pending fixture reconciliation of membership, scope and printed control semantics."
      ],
      "scope": {
        "kind": "group",
        "groupRef": "accountGroup"
      },
      "calculatedRef": "calc.urozvrh-v2-unverified.foot3.field-49",
      "printedControlRef": "urozvrh-v2-unverified.foot3.field-49",
      "absoluteTolerance": "0",
      "coverageRequirement": "completeScope",
      "onMissingInput": "inconclusive",
      "onPartialCoverage": "notEvaluated"
    }
  ]
}
